{"$schema":"https://json-schema.org/draft/2020-12/schema","$id":"urn:ww2-rts:tables-transport:proposal:1:tables","title":"Unagreed table envelope","type":"object","required":["t","schemaVersion","contentSha256","json"],"properties":{"t":{"const":"tables"},"schemaVersion":{"const":1},"contentSha256":{"type":"string","pattern":"^[0-9a-f]{64}$"},"json":{"type":"string","minLength":1,"maxLength":1048576}},"additionalProperties":false,"$comment":"Runtime also enforces decoded json UTF-8 bytes <=1048576 and complete outer frame UTF-8 bytes <=2097664. Hash covers exact decoded json UTF-8 bytes including its final LF; no normalization or reserialization."}
