{"contentSha256":"5de90a7990ec5e8a2903436ac4809302464be29b546d79591a2adc08c68a2efd","json":"{\"formation\":{\"hash\":\"ed0ee23d32a621d1\",\"numbers\":{\"depthSteps\":100,\"infantrySlot\":3,\"lineRank\":10,\"maxStretch\":3,\"rankGap\":1.5,\"slotMargin\":1.5,\"vehicleSlot\":5},\"scope\":\"formation-only\",\"shapes\":[\"line\",\"block\",\"column\",\"wedge\"]},\"reference\":\"e4e579a838aabae3b1d9dadbc17a0a87147bc52d\",\"schemaVersion\":1,\"tables\":{\"AB_MUN\":{\"ap\":15,\"barrage\":25,\"grenade\":15,\"satchel\":30,\"smoke\":10,\"suppress\":10,\"ura\":10},\"AUTO_FLAG\":16384,\"BASE_SURFACES\":\".D+MWF\",\"BIOMES\":[\"farmland\",\"pine\",\"marsh\",\"highland\",\"orchard\",\"steppe\"],\"BUILDABLE\":[\"supplycache\",\"depot\",\"barracks\",\"motorpool\",\"airfield\",\"armory\",\"flakpos\",\"pillbox\",\"tower\",\"shipyard\"],\"CARGO_FLAG\":524288,\"CARGO_SHIFT\":23,\"CELL\":2,\"CFG\":{\"aid\":{\"board\":4.5,\"calm\":5,\"carrier\":10,\"evict\":0.3,\"heal\":5,\"hot\":0.5,\"hurt\":0.9,\"medic\":10,\"radius\":12,\"seek\":30,\"slow\":2},\"air\":{\"bail\":0.35,\"offmap\":40,\"orbit\":18,\"rearm\":30,\"seeRange\":60,\"seek\":60,\"station\":50},\"armies\":{\"endless\":{\"income\":20,\"pop\":5},\"large\":{\"income\":3,\"pop\":2.5},\"massive\":{\"income\":6,\"pop\":5},\"standard\":{\"income\":1,\"pop\":1}},\"assault\":{\"annihilationBase\":4.5,\"annihilationMp\":300,\"attackerBase\":5,\"attackerMp\":320,\"baseFlak\":4,\"defenderBase\":3.5,\"defenderMp\":250,\"directMul\":0.25,\"fortRadius\":15,\"howitzerMul\":0.1,\"supportMul\":0.05,\"time\":900},\"autoRetreat\":0.35,\"behavior\":{\"coverSeek\":4,\"coverShift\":4,\"gap\":5,\"hullTurn\":1.5,\"pullBack\":10,\"reverseMax\":16,\"reverseSpeed\":0.5,\"spacing\":3,\"switchGain\":0.7,\"threatTime\":5,\"vehicleSpacing\":5},\"bounty\":0.2,\"camoRange\":12,\"captureTime\":8,\"catchupMax\":6,\"catchupPer\":60,\"churn\":0.3,\"classic\":{\"aiAttackRatio\":1.1,\"aiSeenWindow\":30,\"buildReach\":2.5,\"contestedFuel\":1.5,\"crew\":0.72,\"decay\":0.01,\"homeRate\":2.5,\"hqFuel\":0.5,\"hqMun\":0.5,\"minInc\":0.5,\"mpStart\":200,\"munPerVp\":1.5,\"popCap\":24,\"repair\":0.005,\"smallArms\":0.25,\"startForce\":[\"engineer\",\"rifle\"],\"time\":1500,\"trickle\":3,\"upkeep\":0.0008},\"coverMul\":0.5,\"coverSeek\":10,\"crush\":{\"#\":\"+\",\"H\":\".\",\"T\":\"+\",\"X\":\".\"},\"digCells\":4,\"digCost\":30,\"digTime\":3,\"dustSeen\":1.3,\"eye\":1.6,\"fire\":{\"burn\":{\".\":5,\"B\":25,\"H\":14,\"O\":20},\"ignite\":{\".\":0.03,\"B\":0.15,\"H\":0.3,\"O\":0.2},\"inf\":8,\"smoke\":{\"r\":5,\"t\":12},\"spread\":{\".\":0.022,\"B\":0.03,\"H\":0.25,\"O\":0.12},\"supp\":12},\"fordSpeed\":[0.75,0.35],\"fortBuilders\":[\"rifle\",\"conscript\",\"engineer\"],\"garrisonEvictDamage\":0.3,\"garrisonVision\":1.25,\"highGroundAcc\":0.15,\"highGroundVision\":0.1,\"horde\":{\"airWave\":10,\"boss\":10,\"break\":45,\"budget\":300,\"field\":60,\"fieldMax\":240,\"growth\":1.25,\"heal\":0.1,\"heavyWave\":12,\"reveal\":3,\"support\":150,\"supportWave\":6,\"unlock\":[[\"rifle\",1,4],[\"conscript\",1,4],[\"mg\",3,2],[\"mortar\",3,1],[\"medic\",4,1],[\"armoredcar\",5,1],[\"tank\",5,2],[\"at\",5,1],[\"flamer\",6,1],[\"halftrack\",6,1],[\"medium\",8,2],[\"tankdestroyer\",8,1],[\"rocket\",8,1],[\"ranger\",9,1],[\"sniper\",10,1],[\"howitzer\",10,1],[\"commando\",11,1],[\"tiger\",12,1],[\"churchill\",14,1]],\"vetEvery\":4,\"vetWave\":10},\"houses\":[{\"hp\":250,\"min\":0,\"mul\":0.55,\"name\":\"wooden shed\",\"worn\":0.85},{\"hp\":400,\"min\":11,\"mul\":0.35,\"name\":\"brick house\",\"worn\":0.7},{\"hp\":650,\"min\":24,\"mul\":0.25,\"name\":\"stone building\",\"worn\":0.55},{\"hp\":700,\"min\":{\"$number\":\"Infinity\"},\"mul\":0.25,\"name\":\"church\",\"vision\":1.6,\"worn\":0.55},{\"hp\":1000,\"min\":{\"$number\":\"Infinity\"},\"mul\":0.2,\"name\":\"factory\",\"vision\":1.4,\"worn\":0.45},{\"hp\":800,\"min\":{\"$number\":\"Infinity\"},\"mul\":0.25,\"name\":\"mine head\",\"vision\":1.5,\"worn\":0.5}],\"levelHeight\":2.5,\"march\":{\"calm\":10,\"speed\":1.5},\"maxLevel\":4,\"minLevel\":-2,\"mine\":{\"blast\":3,\"detect\":6,\"inf\":45,\"supp\":60,\"sweep\":2,\"veh\":220},\"mpBase\":4,\"mpStart\":150,\"mudSpeed\":[0.7,0.35],\"paraRange\":300,\"pointRadius\":8,\"popCap\":12,\"radioCd\":1.5,\"rail\":{\"cars\":8,\"every\":20,\"load\":8,\"reach\":30,\"unload\":2},\"reinforceEvery\":2,\"reinforceRadius\":15,\"retreatDamage\":0.25,\"retreatSpeed\":1.5,\"riderShock\":60,\"roadSpeed\":1.35,\"rubbleSpill\":0.35,\"scar\":{\"hit\":600,\"tank\":0.25},\"shoal\":10,\"shoreReach\":5,\"slope\":[0.2,0.45],\"smokeSight\":15,\"spawnGhost\":4,\"startForce\":[\"rifle\",\"rifle\",\"mg\"],\"stoneBridge\":12,\"supply\":{\"damage\":0.05,\"damageCells\":5,\"every\":40,\"far\":600,\"floor\":0.25,\"free\":16,\"hop\":0.15,\"near\":150,\"network\":20,\"zoc\":8},\"terrainHp\":{\"#\":150,\"=\":200,\"A\":150,\"H\":60,\"N\":1,\"O\":200,\"Q\":300,\"X\":40,\"Y\":250},\"traffic\":0.05,\"trench\":{\"arc\":0.3,\"dug\":0.3,\"fresh\":0.5,\"hide\":18,\"hp\":400,\"rally\":14,\"settle\":8,\"speed\":1.2},\"trenchBlastMul\":0.5,\"vetAcc\":0.1,\"vetArmor\":0.08,\"vetSupp\":0.15,\"vetXp\":[1,2.5,5],\"vpToWin\":1200,\"wallHug\":0.5,\"weather\":{\"dry\":[240,480],\"dryOut\":240,\"firstRain\":180,\"rain\":[90,180],\"sight\":0.2,\"soak\":90,\"wetFord\":0.3,\"wetGround\":0.2,\"wetWear\":3},\"windSpeed\":1.2,\"wireSpeed\":0.35,\"wood\":{\"cover\":0.6,\"sight\":3,\"speed\":0.5},\"wreck\":{\"#\":\"+\",\"=\":\"W\",\"A\":\"+\",\"B\":\"R\",\"H\":\".\",\"N\":\"+\",\"O\":\".\",\"Q\":\"+\",\"X\":\".\",\"Y\":\".\"},\"wrecks\":40},\"CORNER_BULGE\":0.4,\"COVER\":4,\"DEBRIS_LIMITS\":{\"active\":96,\"contacts\":8,\"lifetime\":2.5,\"maxStep\":0.05},\"DOCTRINE\":{\"3\":{\"shells\":{\"artillery\":1.5}}},\"ENTRENCH\":{\"arc\":\"Arc\",\"double\":\"Double line\",\"line\":\"Trench line\",\"ring\":\"Ring\",\"strongpoint\":\"Strongpoint\",\"zigzag\":\"Zigzag trench\"},\"ENTRENCH_TYPES\":[\"line\",\"zigzag\",\"double\",\"arc\",\"ring\",\"strongpoint\"],\"FACTION_COUNT\":4,\"FIELD_BUILDS\":[\"flakpos\",\"supplycache\"],\"FORD\":16,\"FORTS\":{\"aid\":{\"ch\":\"A\",\"cost\":100,\"n\":1,\"name\":\"Field Hospital\",\"single\":true,\"time\":12},\"bridge\":{\"along\":true,\"ch\":\"=\",\"cost\":80,\"n\":5,\"name\":\"Bridge\",\"on\":\"W\",\"reach\":9},\"demine\":{\"ch\":\".\",\"clear\":true,\"cost\":5,\"n\":4,\"name\":\"Clear mines\",\"reach\":8},\"fill\":{\"ch\":\".\",\"cost\":10,\"fill\":true,\"n\":5,\"name\":\"Fill in\"},\"gate\":{\"cost\":150,\"n\":3,\"name\":\"Gate\",\"point\":true,\"reach\":6,\"tier\":2,\"time\":10,\"unit\":\"gate\"},\"mines\":{\"ch\":\"N\",\"cost\":40,\"n\":4,\"name\":\"Minefield\"},\"nest\":{\"cost\":60,\"name\":\"Gun Pit\",\"nest\":true,\"range\":1.25},\"sandbags\":{\"ch\":\"#\",\"cost\":20,\"n\":4,\"name\":\"Sandbags\"},\"traps\":{\"ch\":\"Y\",\"cost\":40,\"n\":4,\"name\":\"Tank Traps\"},\"trench\":{\"ch\":\"T\",\"cost\":30,\"n\":4,\"name\":\"Trench\"},\"wall\":{\"cost\":120,\"n\":4,\"name\":\"Concrete Wall\",\"reach\":6,\"tier\":2,\"time\":6,\"unit\":\"wall\"},\"wire\":{\"ch\":\"X\",\"cost\":25,\"n\":5,\"name\":\"Barbed Wire\"}},\"GATE_OPEN_FLAG\":65536,\"GUN_SLOTS\":{\"at\":[[-0.1,1.15],[-0.1,-1.15],[-0.85,1.5],[-0.85,-1.5]],\"flak\":[[0,1.15],[0,-1.15],[-0.95,1.2]],\"howitzer\":[[-0.35,1],[-0.55,-0.95],[-1.3,0.55],[-1.5,-0.6]],\"mg\":[[-0.12,0],[-0.05,0.85],[-0.05,-0.85]],\"mortar\":[[-0.45,0.75],[-0.45,-0.75],[0.2,-1]]},\"LAND\":1024,\"LANE\":{\"ahead\":32,\"hold\":16,\"margin\":1.5},\"MATERIALS\":{\"concrete\":{\"absorption\":0.25,\"crater\":0,\"fire\":0.2,\"hardness\":0.95,\"name\":\"concrete\",\"rebound\":0.65},\"road\":{\"absorption\":0.65,\"crater\":0.5,\"fire\":0,\"hardness\":0.45,\"name\":\"road\",\"rebound\":0.12},\"soil\":{\"absorption\":0.9,\"crater\":1,\"fire\":0,\"hardness\":0.12,\"name\":\"soil\",\"rebound\":0.02},\"steel\":{\"absorption\":0.15,\"crater\":0,\"fire\":0,\"hardness\":1,\"name\":\"steel\",\"rebound\":0.75},\"stone\":{\"absorption\":0.3,\"crater\":0,\"fire\":0.4,\"hardness\":0.85,\"name\":\"stone\",\"rebound\":0.55},\"water\":{\"absorption\":1,\"crater\":0,\"fire\":0,\"hardness\":0,\"name\":\"water\",\"rebound\":0},\"wood\":{\"absorption\":0.8,\"crater\":0,\"fire\":1,\"hardness\":0.3,\"name\":\"wood\",\"rebound\":0.05}},\"MAX_PLAYERS\":6,\"MOVE\":1,\"MOVEMENT_PROFILES\":{\"airfield\":null,\"armoredcar\":{\"acceleration\":6.5,\"braking\":9,\"hullTurn\":1.7,\"reverseAcceleration\":3.5,\"reverseSpeed\":0.4,\"tracked\":false},\"armory\":null,\"at\":null,\"attacker\":null,\"barracks\":null,\"bomber\":null,\"bunker\":null,\"churchill\":{\"acceleration\":1.9,\"braking\":4.5,\"hullTurn\":0.85,\"reverseAcceleration\":1.6,\"reverseSpeed\":0.4,\"tracked\":true},\"commando\":null,\"conscript\":null,\"depot\":null,\"destroyer\":null,\"engineer\":null,\"fighter\":null,\"flak\":null,\"flakpos\":null,\"flaktrack\":{\"acceleration\":4,\"braking\":7,\"hullTurn\":1.35,\"reverseAcceleration\":2.7,\"reverseSpeed\":0.4,\"tracked\":false},\"flamer\":null,\"gate\":null,\"gunboat\":null,\"halftrack\":{\"acceleration\":5.2,\"braking\":8,\"hullTurn\":1.5,\"reverseAcceleration\":3,\"reverseSpeed\":0.4,\"tracked\":false},\"howitzer\":null,\"hq\":null,\"kaiju\":{\"acceleration\":4,\"braking\":7,\"hullTurn\":1.5,\"reverseAcceleration\":2.5,\"reverseSpeed\":0.45,\"tracked\":true},\"lcvp\":null,\"lorry\":{\"acceleration\":4,\"braking\":7,\"hullTurn\":1.5,\"reverseAcceleration\":2.5,\"reverseSpeed\":0.45,\"tracked\":true},\"medic\":null,\"medium\":{\"acceleration\":3.5,\"braking\":6.5,\"hullTurn\":1.25,\"reverseAcceleration\":2.8,\"reverseSpeed\":0.45,\"tracked\":true},\"mg\":null,\"mortar\":null,\"motorpool\":null,\"pillbox\":null,\"ranger\":null,\"rifle\":null,\"rocket\":{\"acceleration\":2.8,\"braking\":5.5,\"hullTurn\":1.1,\"reverseAcceleration\":2,\"reverseSpeed\":0.4,\"tracked\":false},\"shipyard\":null,\"sniper\":null,\"supplycache\":null,\"tank\":{\"acceleration\":4.8,\"braking\":7.5,\"hullTurn\":1.5,\"reverseAcceleration\":4,\"reverseSpeed\":0.5,\"tracked\":true},\"tankdestroyer\":{\"acceler